,name,price,quantity_sold,shop_name,url
0,Quần Jean Xám Mỏng Màu Xám Khói Lưng Cao Ống Rộng Phong Cách Hàn Quốc Thiết Kế Mới 2022 Cho Nữ,160.072,Đã bán 931,,https://shopee.vn/Quần-Jean-Xám-Mỏng-Màu-Xám-Khói-Lưng-Cao-Ống-Rộng-Phong-Cách-Hàn-Quốc-Thiết-Kế-Mới-2022-Cho-Nữ-i.734451476.15872129067?sp_atk=3476204b-e0d8-4e41-944e-44d25a2225b4&xptdk=3476204b-e0d8-4e41-944e-44d25a2225b4
1,Quần jeans lưng cao ống rộng màu RETRO,139.000,"Đã bán 4,6k",,https://shopee.vn/Quần-jeans-lưng-cao-ống-rộng-màu-RETRO-i.168779384.18350874311?sp_atk=ab71c9ff-42bd-4424-9b06-8c68720ae6b9&xptdk=ab71c9ff-42bd-4424-9b06-8c68720ae6b9
2,"Quần jean nam nữ unisex dáng suông rộng, quần bò baggy trơn form ống rộng dễ phối đồ, chất jean đẹp",99.000,"Đã bán 29,9k",,https://shopee.vn/Quần-jean-nam-nữ-unisex-dáng-suông-rộng-quần-bò-baggy-trơn-form-ống-rộng-dễ-phối-đồ-chất-jean-đẹp-i.40021101.6296792784?sp_atk=6ae41609-ccfc-44ab-9cc5-b5a2d9e19c9a&xptdk=6ae41609-ccfc-44ab-9cc5-b5a2d9e19c9a
3,Daduhey Quần jeans ống rộng eo cao thời trang đường phố sành điệu với 6 màu tùy chọn dành cho nữ,142.000,"Đã bán 16,9k",,https://shopee.vn/Daduhey-Quần-jeans-ống-rộng-eo-cao-thời-trang-đường-phố-sành-điệu-với-6-màu-tùy-chọn-dành-cho-nữ-i.243563394.12264559828?sp_atk=db93fa2f-2e35-41a9-8363-77426d86fc9c&xptdk=db93fa2f-2e35-41a9-8363-77426d86fc9c
4,"Quần jean nam đen ống suông rộng CẠP CAO, Quần bò nam rộng mầu xanh dáng baggy xu hướng 2023 HELLOYOU",145.000,"Đã bán 12,7k",,https://shopee.vn/Quần-jean-nam-đen-ống-suông-rộng-CẠP-CAO-Quần-bò-nam-rộng-mầu-xanh-dáng-baggy-xu-hướng-2023-HELLOYOU-i.275899480.8917923428?sp_atk=3c595d8c-b1d9-4b25-b966-cf611080357b&xptdk=3c595d8c-b1d9-4b25-b966-cf611080357b
5,Quần Jeans Dài Ống Rộng Lưng Cao Rách Gối Thời Trang Cho Nữ,174.243,"Đã bán 2,3k",,https://shopee.vn/Quần-Jeans-Dài-Ống-Rộng-Lưng-Cao-Rách-Gối-Thời-Trang-Cho-Nữ-i.734451476.20605901260?sp_atk=ecfca122-63e3-49c9-a58f-589351577c74&xptdk=ecfca122-63e3-49c9-a58f-589351577c74
6,Quần jean ZHELIHANGFEI mỏng màu xám khói lưng cao ống rộng phong cách Hàn Quốc thiết kế thời trang 2022 cho nữ,241.970,Đã bán 143,,https://shopee.vn/Quần-jean-ZHELIHANGFEI-mỏng-màu-xám-khói-lưng-cao-ống-rộng-phong-cách-Hàn-Quốc-thiết-kế-thời-trang-2022-cho-nữ-i.744827142.19132889986?sp_atk=8b0b3259-27b9-42d1-9776-31a224615b36&xptdk=8b0b3259-27b9-42d1-9776-31a224615b36
7,"QUẦN JEANS CHẤT BÒ, ỐNG SUÔNG RỘNG RÁCH LOANG 2 MÀU ĐEN CẠP CAO DÀI CHÂN SIÊU TÔN DANGSANG CHẢNH - DUBATI FASHION",83.200,Đã bán 170,,https://shopee.vn/QUẦN-JEANS-CHẤT-BÒ-ỐNG-SUÔNG-RỘNG-RÁCH-LOANG-2-MÀU-ĐEN-CẠP-CAO-DÀI-CHÂN-SIÊU-TÔN-DANGSANG-CHẢNH-DUBATI-FASHION-i.88972759.18029189998?sp_atk=bed5cae1-ec20-4628-af91-c5e252403a7f&xptdk=bed5cae1-ec20-4628-af91-c5e252403a7f
8,Quần jean nữ ống rộng đen xám phong cách Ulzzang - Quần jeans baggy suông màu xám tro UF01,139.000,"Đã bán 4,4k",,https://shopee.vn/Quần-jean-nữ-ống-rộng-đen-xám-phong-cách-Ulzzang-Quần-jeans-baggy-suông-màu-xám-tro-UF01-i.752498846.16077573906?sp_atk=577123d6-db85-4f74-aee5-7d3e463a4d17&xptdk=577123d6-db85-4f74-aee5-7d3e463a4d17
9,Quần Jean Nữ Ống Rộng Lưng Cao Rách Gối Thời Trang Mới,167.750,Đã bán 418,,https://shopee.vn/Quần-Jean-Nữ-Ống-Rộng-Lưng-Cao-Rách-Gối-Thời-Trang-Mới-i.391866872.19334918652?sp_atk=827eee0c-0271-42e3-903e-75d79eb4e439&xptdk=827eee0c-0271-42e3-903e-75d79eb4e439
10,Quần jean nam BASIC ống suông rộng dáng baggy Wash 2 màu đen - xám mã DX01,132.000,"Đã bán 10,6k",,https://shopee.vn/Quần-jean-nam-BASIC-ống-suông-rộng-dáng-baggy-Wash-2-màu-đen-xám-mã-DX01-i.439135281.11008647077?sp_atk=45ce56b8-3196-4874-8c1f-b07be4f62cdd&xptdk=45ce56b8-3196-4874-8c1f-b07be4f62cdd
11,"quần jean nam chữ thập thêu rách gối khóa séc zip đen HELLOYOU, quần baggy ống rộng thánh giá  hottrend 2023",152.000,"Đã bán 24,3k",,https://shopee.vn/quần-jean-nam-chữ-thập-thêu-rách-gối-khóa-séc-zip-đen-HELLOYOU-quần-baggy-ống-rộng-thánh-giá-hottrend-2023-i.275899480.9917942690?sp_atk=8b9469c6-c0e8-49bc-b380-29718a2ae59f&xptdk=8b9469c6-c0e8-49bc-b380-29718a2ae59f
12,Quần jean baggy nam rách trắng đen 2 gối gấu ống suông rộng chất vải bò cao cấp RG01 Ullzang hàn quốc Helloyou 2022,145.000,"Đã bán 7,4k",,https://shopee.vn/Quần-jean-baggy-nam-rách-trắng-đen-2-gối-gấu-ống-suông-rộng-chất-vải-bò-cao-cấp-RG01-Ullzang-hàn-quốc-Helloyou-2022-i.275899480.6679994716?sp_atk=b6bc4341-dc3c-4601-ae2a-a06f2084d9f8&xptdk=b6bc4341-dc3c-4601-ae2a-a06f2084d9f8
13,"Quần jean nam Baggy phom suông rộng TR01, quần bò nam ống đứng hottrend hàn quốc 2023",145.000,"Đã bán 117,8k",,https://shopee.vn/Quần-jean-nam-Baggy-phom-suông-rộng-TR01-quần-bò-nam-ống-đứng-hottrend-hàn-quốc-2023-i.119017165.5170782167?sp_atk=b55903be-2c52-4dfe-8164-3507df8db3cf&xptdk=b55903be-2c52-4dfe-8164-3507df8db3cf
14,Quần Jean Rách Màu Đen Phong Cách Âu Mỹ Thời Trang Mùa Hè Cho Nữ,179.139,Đã bán 341,,https://shopee.vn/Quần-Jean-Rách-Màu-Đen-Phong-Cách-Âu-Mỹ-Thời-Trang-Mùa-Hè-Cho-Nữ-i.734451476.17043703648?sp_atk=e6b23486-776b-4015-b7a8-a6a8a4bdd967&xptdk=e6b23486-776b-4015-b7a8-a6a8a4bdd967
15,Quần Jean Lưng Cao Ống Suông Thời Trang Retro Đường Phố Mỹ Cho Nữ,252.000,Đã bán 96,,https://shopee.vn/Quần-Jean-Lưng-Cao-Ống-Suông-Thời-Trang-Retro-Đường-Phố-Mỹ-Cho-Nữ-i.460971368.20343261368?sp_atk=30d641d3-1e93-4e31-9dd9-8f62b9e772d8&xptdk=30d641d3-1e93-4e31-9dd9-8f62b9e772d8
16,Quần jean đen nam baggy Wash 2 màu xám ống suông rộng dáng đứng vải jeans bò cao cấp 20WE SR01 hottrend 2022,139.000,"Đã bán 10,4k",,https://shopee.vn/Quần-jean-đen-nam-baggy-Wash-2-màu-xám-ống-suông-rộng-dáng-đứng-vải-jeans-bò-cao-cấp-20WE-SR01-hottrend-2022-i.119017165.6468244078?sp_atk=9fcc9ced-d0c5-4cc8-9648-538123e927cf&xptdk=9fcc9ced-d0c5-4cc8-9648-538123e927cf
17,Quần Bò Ống Suông Rộng Nữ TDSHOPNT Lưng Cao 2 Cúc Dáng Baggy Suông Cá Tính Q125,139.000,"Đã bán 15,3k",,https://shopee.vn/Quần-Bò-Ống-Suông-Rộng-Nữ-TDSHOPNT-Lưng-Cao-2-Cúc-Dáng-Baggy-Suông-Cá-Tính-Q125-i.66495466.10844326345?sp_atk=4dc94e17-fa0e-415d-986a-815dd0ac58fb&xptdk=4dc94e17-fa0e-415d-986a-815dd0ac58fb
18,Quần Jean Ống Rộng Lưng Cao Thêu Chữ Màu Xanh Siêu Cá Tính,239.000,Đã bán 820,,https://shopee.vn/Quần-Jean-Ống-Rộng-Lưng-Cao-Thêu-Chữ-Màu-Xanh-Siêu-Cá-Tính-i.316600188.19042414910?sp_atk=64987ceb-f0fe-4443-af31-81c17c07aa26&xptdk=64987ceb-f0fe-4443-af31-81c17c07aa26
19,Quần Jean Ống Suông Dài Nữ Lưng Cao Cao Cấp Cực Hot OHS3100,114.000,Đã bán 35k,,https://shopee.vn/Quần-Jean-Ống-Suông-Dài-Nữ-Lưng-Cao-Cao-Cấp-Cực-Hot-OHS3100-i.39263040.2623882985?sp_atk=f185fcc8-3bd4-45e8-be5e-fb052c6c253d&xptdk=f185fcc8-3bd4-45e8-be5e-fb052c6c253d
20,Quần baggy nam quần jean nam ống rộng suông đứng chất bò cao cấp PATADO TR01,135.000,"Đã bán 3,1k",,https://shopee.vn/Quần-baggy-nam-quần-jean-nam-ống-rộng-suông-đứng-chất-bò-cao-cấp-PATADO-TR01-i.439735650.11608197190?sp_atk=f6704169-6b47-464e-9e78-9b6ecb94c864&xptdk=f6704169-6b47-464e-9e78-9b6ecb94c864
21,Quần jean ống suông nam phối khóa kéo phong cách hàn quốc quần bò nữ ống đứng unisex bigsize from rộng fashion jeans nam,269.000,Đã bán 63,,https://shopee.vn/Quần-jean-ống-suông-nam-phối-khóa-kéo-phong-cách-hàn-quốc-quần-bò-nữ-ống-đứng-unisex-bigsize-from-rộng-fashion-jeans-nam-i.410938293.19229576191?sp_atk=48eadec3-0884-4943-bb3f-9c75820aa5d3&xptdk=48eadec3-0884-4943-bb3f-9c75820aa5d3
22,QUẦN JEAN ỐNG RỘNG NỮ LƯNG CAO MÀU XANH NHẠT 2 NÚT LAI TUA VẠT CHÉO LƯNG TRÊN CẢ TUYỆT VỜI MANG CẢM HỨNG ĐỘC ĐÁO LẠ MẮT,125.000,"Đã bán 6,9k",,https://shopee.vn/QUẦN-JEAN-ỐNG-RỘNG-NỮ-LƯNG-CAO-MÀU-XANH-NHẠT-2-NÚT-LAI-TUA-VẠT-CHÉO-LƯNG-TRÊN-CẢ-TUYỆT-VỜI-MANG-CẢM-HỨNG-ĐỘC-ĐÁO-LẠ-MẮT-i.174632334.4046379791?sp_atk=f888b724-ccac-4270-99d4-81c3fab88ccf&xptdk=f888b724-ccac-4270-99d4-81c3fab88ccf
23,Quần jean baggy nam nữ  thêu thánh giá mã 006 quần baggy ống suông dáng hàn quốc 2022 unisex kun shop,250.000,"Đã bán 2,6k",,https://shopee.vn/Quần-jean-baggy-nam-nữ-thêu-thánh-giá-mã-006-quần-baggy-ống-suông-dáng-hàn-quốc-2022-unisex-kun-shop-i.133725512.17973519483?sp_atk=423fa5b0-81b9-4f72-b2e4-7a801e19c418&xptdk=423fa5b0-81b9-4f72-b2e4-7a801e19c418
24,Quần ống rộng nữ dây rút túi phong cách MRQ011G,178.450,"Đã bán 19,1k",,https://shopee.vn/Quần-ống-rộng-nữ-dây-rút-túi-phong-cách-MRQ011G-i.152470224.21634260942?sp_atk=e70e1d08-db65-45f3-9735-5c8930eb495a&xptdk=e70e1d08-db65-45f3-9735-5c8930eb495a
25,"Quần jean nam chữ thập ống suông rộng 20WE,Quần bò chữ thập thêu thánh giá xanh đen chất vải cao cấp cá tính 2023",155.000,"Đã bán 4,6k",,https://shopee.vn/Quần-jean-nam-chữ-thập-ống-suông-rộng-20WE-Quần-bò-chữ-thập-thêu-thánh-giá-xanh-đen-chất-vải-cao-cấp-cá-tính-2023-i.119017165.9556717611?sp_atk=2c587f3a-de61-47f3-a87b-0ad90bfc6cc2&xptdk=2c587f3a-de61-47f3-a87b-0ad90bfc6cc2
26,Quần Ống Rộng Kaki Siêu Hot,115.000,Đã bán 10k,,https://shopee.vn/Quần-Ống-Rộng-Kaki-Siêu-Hot-i.408882766.18108990691?sp_atk=fa5b885c-2300-47da-b90e-0a189c86b764&xptdk=fa5b885c-2300-47da-b90e-0a189c86b764
27,🔥Baggy Jeans Lưng Cao Rách Nhiều,99.000,Đã bán 390,,https://shopee.vn/🔥Baggy-Jeans-Lưng-Cao-Rách-Nhiều-i.108163894.7035242081?sp_atk=53037a7d-9323-4a84-8606-12653379d1e3&xptdk=53037a7d-9323-4a84-8606-12653379d1e3
28,Quần jean nam màu xanh nhạt không rách gối chất bò cao cấp co dãn 4 chiều from dáng baggy skinny ADO70 mẫu mới,149.000,Đã bán 20,,https://shopee.vn/Quần-jean-nam-màu-xanh-nhạt-không-rách-gối-chất-bò-cao-cấp-co-dãn-4-chiều-from-dáng-baggy-skinny-ADO70-mẫu-mới-i.389747365.8245877106?sp_atk=9fee29d5-ee55-4831-8dfc-6633cfaba8f7&xptdk=9fee29d5-ee55-4831-8dfc-6633cfaba8f7
29,Quần Jeans Ống Rộng Xám - Quần Ống Rộng Nữ Dáng Suông Jeans Lưng Cao Ulzzang Q41,115.000,"Đã bán 14,3k",,https://shopee.vn/Quần-Jeans-Ống-Rộng-Xám-Quần-Ống-Rộng-Nữ-Dáng-Suông-Jeans-Lưng-Cao-Ulzzang-Q41-i.276087485.8758157140?sp_atk=c2ac6294-e96e-4ef6-b4f1-f9d2174e50c5&xptdk=c2ac6294-e96e-4ef6-b4f1-f9d2174e50c5
30,"Quần baggy kaki suông Chollima QD045 basic nhiều màu,mặc mát, dễ phối đồ phong cách trẻ hàn quốc",119.800,"Đã bán 5,6k",,https://shopee.vn/Quần-baggy-kaki-suông-Chollima-QD045-basic-nhiều-màu-mặc-mát-dễ-phối-đồ-phong-cách-trẻ-hàn-quốc-i.317753260.17939811938?sp_atk=c2f03d8e-4a1a-412f-87dc-f837f26457dd&xptdk=c2f03d8e-4a1a-412f-87dc-f837f26457dd
31,Cocory vn Quần Jean Dài Lưng Cao Ống Suông Thời Trang Đường Phố Cá Tính Cho Nữ,249.000,"Đã bán 1,5k",,https://shopee.vn/Cocory-vn-Quần-Jean-Dài-Lưng-Cao-Ống-Suông-Thời-Trang-Đường-Phố-Cá-Tính-Cho-Nữ-i.332345704.18108793591?sp_atk=d150f0db-02a8-463e-944d-d4ca91422e97&xptdk=d150f0db-02a8-463e-944d-d4ca91422e97
32,"Quần jean vá da,Quần bò vá da AIMIRI khâu viền 🔥 Cao cấp SIÊU HOT",219.000,Đã bán 1k,,https://shopee.vn/Quần-jean-vá-da-Quần-bò-vá-da-AIMIRI-khâu-viền-🔥-Cao-cấp-SIÊU-HOT-i.883788875.20062911302?sp_atk=a40cda24-08ed-40bc-8ba8-4b864c0c2d3d&xptdk=a40cda24-08ed-40bc-8ba8-4b864c0c2d3d
33,Quần jean Xiaozhainv ống rộng lưng cao phong cách mùa xuân kiểu Hàn Quốc năng động,234.000,"Đã bán 1,5k",,https://shopee.vn/Quần-jean-Xiaozhainv-ống-rộng-lưng-cao-phong-cách-mùa-xuân-kiểu-Hàn-Quốc-năng-động-i.64595367.9998512409?sp_atk=a2664779-424c-4263-b05e-0a8c29c24321&xptdk=a2664779-424c-4263-b05e-0a8c29c24321
34,Quần jeans suông ống rộng lưng cao rách túi QC TNGER,115.500,Đã bán 1k,,https://shopee.vn/Quần-jeans-suông-ống-rộng-lưng-cao-rách-túi-QC-TNGER-i.33273439.16887959407?sp_atk=35b0702e-995d-493d-83d9-545596ba5e4a&xptdk=35b0702e-995d-493d-83d9-545596ba5e4a
35,"Hana quần ống rộng hot trend 2023, quần ống rộng cạp thấp y2k 2023 NEW FE1002",169.000,Đã bán 363,,https://shopee.vn/Hana-quần-ống-rộng-hot-trend-2023-quần-ống-rộng-cạp-thấp-y2k-2023-NEW-FE1002-i.902636681.19172577045?sp_atk=732f6b6d-b911-4311-94e8-55805c0059bf&xptdk=732f6b6d-b911-4311-94e8-55805c0059bf
36,[ VIDEO ] QUẦN JEANS ỐNG RỘNG NỮ LƯNG CAO CẠP CHỈNH RÁCH 3 MẢNG GỐI MÀU XÁM ĐẬM DÀY DẶN MỀM MỊN HOT HIT PHONG CÁCH NITI,105.000,"Đã bán 2,1k",,https://shopee.vn/-VIDEO-QUẦN-JEANS-ỐNG-RỘNG-NỮ-LƯNG-CAO-CẠP-CHỈNH-RÁCH-3-MẢNG-GỐI-MÀU-XÁM-ĐẬM-DÀY-DẶN-MỀM-MỊN-HOT-HIT-PHONG-CÁCH-NITI-i.140338732.18535350435?sp_atk=167418b8-9e3a-4283-8ea0-6e695ec92f28&xptdk=167418b8-9e3a-4283-8ea0-6e695ec92f28
37,"Hana quần ống rộng hot trend 2023, quần ống rộng cạp thấp y2k 2023 NEW FE1004",149.000,Đã bán 711,,https://shopee.vn/Hana-quần-ống-rộng-hot-trend-2023-quần-ống-rộng-cạp-thấp-y2k-2023-NEW-FE1004-i.902636681.18072576827?sp_atk=f94b1f10-54a2-4a5b-8a59-8891598d8c53&xptdk=f94b1f10-54a2-4a5b-8a59-8891598d8c53
38,Quần Jean Ống Suông Cạp Cao Phong Cách Ulzzang_J9,139.000,"Đã bán 2,9k",,https://shopee.vn/Quần-Jean-Ống-Suông-Cạp-Cao-Phong-Cách-Ulzzang_J9-i.102763167.5564201056?sp_atk=f4f3512e-baed-4acb-9740-61e32a864198&xptdk=f4f3512e-baed-4acb-9740-61e32a864198
39,[ VIDEO CỰC ĐỈNH ] QUẦN JEAN ỐNG RỘNG DÀI NỮ CAO CẤP HADI CỰC HOT-NL12309,95.000,"Đã bán 29,1k",,https://shopee.vn/-VIDEO-CỰC-ĐỈNH-QUẦN-JEAN-ỐNG-RỘNG-DÀI-NỮ-CAO-CẤP-HADI-CỰC-HOT-NL12309-i.174632334.7208824495?sp_atk=a2bc3ddd-2b7d-441d-b5da-1f306a8ab3bf&xptdk=a2bc3ddd-2b7d-441d-b5da-1f306a8ab3bf
40,(Sẵn Hàng ) Quần ống đứng rách ngang dễ mặc,77.000,Đã bán 603,,https://shopee.vn/(Sẵn-Hàng-)-Quần-ống-đứng-rách-ngang-dễ-mặc-i.25939487.23515556094?sp_atk=608dd924-c6b6-4004-8a52-7ce32158136e&xptdk=608dd924-c6b6-4004-8a52-7ce32158136e
41,Quần DÀI KAKI BASIC PANTS màu TAN Ulzzang UNISEX 1hitshop,113.000,"Đã bán 52,8k",,https://shopee.vn/Quần-DÀI-KAKI-BASIC-PANTS-màu-TAN-Ulzzang-UNISEX-1hitshop-i.71861331.1263812331?sp_atk=95ad3655-200f-48bd-8464-ce66a826025b&xptdk=95ad3655-200f-48bd-8464-ce66a826025b
42,"Quần Jeans Baggy [99k TDSHOPX6] Ống Rộng Cạp Chéo Cao Nữ, Quần Bò Suông Style Hàn Quốc 2021 -Anh Ribi",95.000,"Đã bán 2,2k",,https://shopee.vn/Quần-Jeans-Baggy-99k-TDSHOPX6-Ống-Rộng-Cạp-Chéo-Cao-Nữ-Quần-Bò-Suông-Style-Hàn-Quốc-2021-Anh-Ribi-i.345492648.10441589237?sp_atk=a0a82a8d-d517-4b88-b348-5f5debe1bf46&xptdk=a0a82a8d-d517-4b88-b348-5f5debe1bf46
43,"Quần jean nam baggy CẠP CHUN BẢN TO ống rộng HELLOYOU ,Quần Bò Nam chun CẠP CAO phom Suông Chỉnh Eo Chất Bò cao cấp 2023",145.000,"Đã bán 1,5k",,https://shopee.vn/Quần-jean-nam-baggy-CẠP-CHUN-BẢN-TO-ống-rộng-HELLOYOU-Quần-Bò-Nam-chun-CẠP-CAO-phom-Suông-Chỉnh-Eo-Chất-Bò-cao-cấp-2023-i.275899480.9917935829?sp_atk=35dc9918-0f1d-457a-b710-71994da10dad&xptdk=35dc9918-0f1d-457a-b710-71994da10dad
44,Quần jean denim tocjean ống đứng form rộng vừa xanh nhạt -8166,159.000,"Đã bán 2,7k",,https://shopee.vn/Quần-jean-denim-tocjean-ống-đứng-form-rộng-vừa-xanh-nhạt-8166-i.180633733.20206694105?sp_atk=0322f9da-ab73-420a-90c7-fe86a3b71029&xptdk=0322f9da-ab73-420a-90c7-fe86a3b71029
45,Daduhey Quần ống suông rộng thiết kế túi kiểu Mỹ retro cổ điển,199.000,Đã bán 573,,https://shopee.vn/Daduhey-Quần-ống-suông-rộng-thiết-kế-túi-kiểu-Mỹ-retro-cổ-điển-i.243563394.18633384865?sp_atk=82807229-f3e3-4fc2-a405-83219286e6d2&xptdk=82807229-f3e3-4fc2-a405-83219286e6d2
46,Honypove Quần Jean Dài Ống Rộng Lưng Cao Thời Trang Cá Tính Cho Nữ,179.000,Đã bán 51,,https://shopee.vn/Honypove-Quần-Jean-Dài-Ống-Rộng-Lưng-Cao-Thời-Trang-Cá-Tính-Cho-Nữ-i.446689437.20672391433?sp_atk=6cbd427a-f887-4bcc-8af4-138466880f5e&xptdk=6cbd427a-f887-4bcc-8af4-138466880f5e
47,Quần jeans ống suông rộng đen xám nữ phong cách Retro Ulzzang (Có Bigsize ) - Quần jean ống rộng Kyubi JEMI.Re,129.000,"Đã bán 31,6k",,https://shopee.vn/Quần-jeans-ống-suông-rộng-đen-xám-nữ-phong-cách-Retro-Ulzzang-(Có-Bigsize-)-Quần-jean-ống-rộng-Kyubi-JEMI.Re-i.448978223.10119280649?sp_atk=3fd2aa3a-30fb-4a48-9152-f376818f3940&xptdk=3fd2aa3a-30fb-4a48-9152-f376818f3940
48,Quần Jean Ống Loe Cạp Cao nữ màu Đen vải bò giấy trơn co giãn gấu tua dáng quần tây ống loe lưng cao đi học làm công sở,89.000,"Đã bán 7,9k",,https://shopee.vn/Quần-Jean-Ống-Loe-Cạp-Cao-nữ-màu-Đen-vải-bò-giấy-trơn-co-giãn-gấu-tua-dáng-quần-tây-ống-loe-lưng-cao-đi-học-làm-công-sở-i.800497617.16582366406?sp_atk=0a5896ac-d930-4eee-8c9c-a885eef50d8c&xptdk=0a5896ac-d930-4eee-8c9c-a885eef50d8c
49,Quần Jean Dài Ống Rộng Nhiều Túi Phong Cách Retro Thời Trang Cho Nữ,256.581,Đã bán 30,,https://shopee.vn/Quần-Jean-Dài-Ống-Rộng-Nhiều-Túi-Phong-Cách-Retro-Thời-Trang-Cho-Nữ-i.734451476.10198051889?sp_atk=9e9daefb-273c-4ed9-ae5e-7081d40a8fa5&xptdk=9e9daefb-273c-4ed9-ae5e-7081d40a8fa5
50,"Quần jean nam đen baggy ống suông rộng 20we chất vải bò cao cấp dày dặn, không xù top xu hướng TR01 hottrend 2022",145.000,Đã bán 33k,,https://shopee.vn/Quần-jean-nam-đen-baggy-ống-suông-rộng-20we-chất-vải-bò-cao-cấp-dày-dặn-không-xù-top-xu-hướng-TR01-hottrend-2022-i.119017165.5668238587?sp_atk=77cee8a6-eef3-4046-a544-9f75d81021c3&xptdk=77cee8a6-eef3-4046-a544-9f75d81021c3
51,Quần jean nam retro form rộng dài quần jean ống rộng nữ Hiphop quần bò nữ Hàn Quốc Cho quần jean nam cao cấp,159.000,Đã bán 74,,https://shopee.vn/Quần-jean-nam-retro-form-rộng-dài-quần-jean-ống-rộng-nữ-Hiphop-quần-bò-nữ-Hàn-Quốc-Cho-quần-jean-nam-cao-cấp-i.806820129.18330073422?sp_atk=ee375d8b-c32c-4f5f-a808-b2ddc7a44cf5&xptdk=ee375d8b-c32c-4f5f-a808-b2ddc7a44cf5
52,Quần baggy đen wash cạp cao mix chun ống rộng Basic Brokeboiz,319.000,Đã bán 574,,https://shopee.vn/Quần-baggy-đen-wash-cạp-cao-mix-chun-ống-rộng-Basic-Brokeboiz-i.74173043.18356643210?sp_atk=6c72c158-30b1-4135-a973-6201568f2407&xptdk=6c72c158-30b1-4135-a973-6201568f2407
53,Quần ống rộng nữ chất nhung tăm cạp khóa trước,85.000,"Đã bán 9,1k",,https://shopee.vn/Quần-ống-rộng-nữ-chất-nhung-tăm-cạp-khóa-trước-i.243665750.12109732917?sp_atk=5feba3b7-dcd0-4a25-bd16-6f92a7cdf372&xptdk=5feba3b7-dcd0-4a25-bd16-6f92a7cdf372
54,Quần bò ống rộng DH12,86.000,"Đã bán 35,4k",,https://shopee.vn/Quần-bò-ống-rộng-DH12-i.14889238.6035669245?sp_atk=ce0cc394-6f49-45f7-a8c0-0445878654b1&xptdk=ce0cc394-6f49-45f7-a8c0-0445878654b1
55,"Quần jean trắng ống suông, quần jean kaki đen ống đứng rách gối 2036",155.000,"Đã bán 10,1k",,https://shopee.vn/Quần-jean-trắng-ống-suông-quần-jean-kaki-đen-ống-đứng-rách-gối-2036-i.233545991.11808019054?sp_atk=567ec3a1-c42f-4c0e-b440-c5c38e9ff8f3&xptdk=567ec3a1-c42f-4c0e-b440-c5c38e9ff8f3
56,Quần Jean Ống Rộng Dài Nữ SIMPLE JEANS Lưng Cao Dáng Suông Cao Cấp OHS3010,114.000,"Đã bán 20,1k",,https://shopee.vn/Quần-Jean-Ống-Rộng-Dài-Nữ-SIMPLE-JEANS-Lưng-Cao-Dáng-Suông-Cao-Cấp-OHS3010-i.39263040.4419534923?sp_atk=e94382b2-1a46-45bf-8426-b893cd37dc2a&xptdk=e94382b2-1a46-45bf-8426-b893cd37dc2a
57,"Quần jean nam ROWAY Fullbox, vải denim co giãn nhẹ, form slim | Jean xánh rách",285.000,"Đã bán 5,5k",,https://shopee.vn/Quần-jean-nam-ROWAY-Fullbox-vải-denim-co-giãn-nhẹ-form-slim-Jean-xánh-rách-i.358123846.8574705966?sp_atk=ebd6a476-92e4-4beb-90e9-997f4c4dea25&xptdk=ebd6a476-92e4-4beb-90e9-997f4c4dea25
58,HUANG YOYO Quần jeans Nữ Lưng Cao Ống Rộng Rách Gối Thời Trang Hàn Quốc,219.000,"Đã bán 2,3k",,https://shopee.vn/HUANG-YOYO-Quần-jeans-Nữ-Lưng-Cao-Ống-Rộng-Rách-Gối-Thời-Trang-Hàn-Quốc-i.510241733.21003803082?sp_atk=07ce0f39-0f24-4b7e-8d01-46bd52625d8d&xptdk=07ce0f39-0f24-4b7e-8d01-46bd52625d8d
59,Quần jean Lovito denim trơn lưng cao xẻ tà L02154 (Xanh lam),238.000,"Đã bán 1,1k",,https://shopee.vn/Quần-jean-Lovito-denim-trơn-lưng-cao-xẻ-tà-L02154-(Xanh-lam)-i.446089250.8274277582?sp_atk=165b1f64-9fbe-4318-a4f7-342c7dd9c00b&xptdk=165b1f64-9fbe-4318-a4f7-342c7dd9c00b
60,"Quần jean nam Baggy phom suông rộng, quần bò nam ống đứng hottrend",109.000,"Đã bán 1,3k",,https://shopee.vn/Quần-jean-nam-Baggy-phom-suông-rộng-quần-bò-nam-ống-đứng-hottrend-i.549899777.17389898854?sp_atk=c064bc60-4ba4-4046-bb12-4cb172b9d68a&xptdk=c064bc60-4ba4-4046-bb12-4cb172b9d68a
61,"Quần Jean Nam Skinny Màu Xanh Chất Liệu Demin Cao Cấp Co Giãn Nhẹ ,From Dáng Chuẩn Hàn Quốc mẫu hottrend giới trẻ 2021",169.000,"Đã bán 3,4k",,https://shopee.vn/Quần-Jean-Nam-Skinny-Màu-Xanh-Chất-Liệu-Demin-Cao-Cấp-Co-Giãn-Nhẹ-From-Dáng-Chuẩn-Hàn-Quốc-mẫu-hottrend-giới-trẻ-2021-i.314444552.11154916537?sp_atk=e0e603a2-2d00-4f30-be4a-b2d23192c59d&xptdk=e0e603a2-2d00-4f30-be4a-b2d23192c59d
62,"Quần nam jean đen ống suông rộng, quần baggy nam dáng đứng chất vải bò cao cấp DRSQUARE hottrend 2022",99.000,"Đã bán 10,4k",,https://shopee.vn/Quần-nam-jean-đen-ống-suông-rộng-quần-baggy-nam-dáng-đứng-chất-vải-bò-cao-cấp-DRSQUARE-hottrend-2022-i.439648449.4388431521?sp_atk=e807cceb-1bbe-4811-be23-c83157512a0c&xptdk=e807cceb-1bbe-4811-be23-c83157512a0c
63,Quần jean nam ANYOUNG quần bò nam kiểu ông rộng dáng suông không bai xù không phai màu Hottrend 2023 QD04,139.000,Đã bán 43k,,https://shopee.vn/Quần-jean-nam-ANYOUNG-quần-bò-nam-kiểu-ông-rộng-dáng-suông-không-bai-xù-không-phai-màu-Hottrend-2023-QD04-i.396434623.8927422683?sp_atk=e9b5cf17-a56b-4683-86c8-fa11a4eeb2e9&xptdk=e9b5cf17-a56b-4683-86c8-fa11a4eeb2e9
64,"Quần nam jean đen ống suông rộng có BIGSIZE,quần baggy nam dáng đứng chất bò cao cấp HELLOYOU hottrend 2023",112.000,"Đã bán 10,9k",,https://shopee.vn/Quần-nam-jean-đen-ống-suông-rộng-có-BIGSIZE-quần-baggy-nam-dáng-đứng-chất-bò-cao-cấp-HELLOYOU-hottrend-2023-i.744258715.17464266381?sp_atk=e182d558-9b2a-4565-9c96-002a0c795616&xptdk=e182d558-9b2a-4565-9c96-002a0c795616
65,Quần baggy đen wash cạp cao mix chun ống rộng Basic Brokeboiz,319.000,Đã bán 574,,https://shopee.vn/Quần-baggy-đen-wash-cạp-cao-mix-chun-ống-rộng-Basic-Brokeboiz-i.74173043.18356643210?sp_atk=1cdffa6a-542f-443e-881c-1c88fbb8175f&xptdk=1cdffa6a-542f-443e-881c-1c88fbb8175f
66,Quần ống rộng nữ chất nhung tăm cạp khóa trước,85.000,"Đã bán 9,1k",,https://shopee.vn/Quần-ống-rộng-nữ-chất-nhung-tăm-cạp-khóa-trước-i.243665750.12109732917?sp_atk=c8a67211-d9c0-4587-8104-9d5ee1dbcea7&xptdk=c8a67211-d9c0-4587-8104-9d5ee1dbcea7
67,Quần bò ống rộng DH12,86.000,"Đã bán 35,4k",,https://shopee.vn/Quần-bò-ống-rộng-DH12-i.14889238.6035669245?sp_atk=706c0b46-f5c9-4dbd-8296-25487e7a60b6&xptdk=706c0b46-f5c9-4dbd-8296-25487e7a60b6
68,"Quần jean trắng ống suông, quần jean kaki đen ống đứng rách gối 2036",155.000,"Đã bán 10,1k",,https://shopee.vn/Quần-jean-trắng-ống-suông-quần-jean-kaki-đen-ống-đứng-rách-gối-2036-i.233545991.11808019054?sp_atk=dcd0c0fb-09eb-4e00-9fd4-c822c443ed0e&xptdk=dcd0c0fb-09eb-4e00-9fd4-c822c443ed0e
69,Quần Jean Ống Rộng Dài Nữ SIMPLE JEANS Lưng Cao Dáng Suông Cao Cấp OHS3010,114.000,"Đã bán 20,1k",,https://shopee.vn/Quần-Jean-Ống-Rộng-Dài-Nữ-SIMPLE-JEANS-Lưng-Cao-Dáng-Suông-Cao-Cấp-OHS3010-i.39263040.4419534923?sp_atk=54552695-ce12-486d-8052-bad1abe1547f&xptdk=54552695-ce12-486d-8052-bad1abe1547f
70,"Quần jean nam ROWAY Fullbox, vải denim co giãn nhẹ, form slim | Jean xánh rách",285.000,"Đã bán 5,5k",,https://shopee.vn/Quần-jean-nam-ROWAY-Fullbox-vải-denim-co-giãn-nhẹ-form-slim-Jean-xánh-rách-i.358123846.8574705966?sp_atk=4268ce8b-0a27-415c-b936-21213bbbe9dc&xptdk=4268ce8b-0a27-415c-b936-21213bbbe9dc
71,HUANG YOYO Quần jeans Nữ Lưng Cao Ống Rộng Rách Gối Thời Trang Hàn Quốc,219.000,"Đã bán 2,3k",,https://shopee.vn/HUANG-YOYO-Quần-jeans-Nữ-Lưng-Cao-Ống-Rộng-Rách-Gối-Thời-Trang-Hàn-Quốc-i.510241733.21003803082?sp_atk=56faa2b7-5437-40d9-bda1-cfb940f05cec&xptdk=56faa2b7-5437-40d9-bda1-cfb940f05cec
72,Quần jean Lovito denim trơn lưng cao xẻ tà L02154 (Xanh lam),238.000,"Đã bán 1,1k",,https://shopee.vn/Quần-jean-Lovito-denim-trơn-lưng-cao-xẻ-tà-L02154-(Xanh-lam)-i.446089250.8274277582?sp_atk=47218a06-e7ce-41db-9b3a-59488c755e09&xptdk=47218a06-e7ce-41db-9b3a-59488c755e09
